{
  "schema_id": "kolibri.product.thread",
  "schema_version": "1.0",
  "tenant_id": "tenant_01JZPRODUCT01",
  "project_id": "project_01JZPRODUCT001",
  "thread_id": "thread_01JZPRODUCT001",
  "title": "Основной диалог проекта",
  "status": "active",
  "branch_count": 1,
  "last_message_sequence": 1,
  "last_run_sequence": 1,
  "version": 1,
  "created_by": "user_01JZPRODUCT0001",
  "created_at": "2026-07-26T12:00:00.000+03:00",
  "updated_at": "2026-07-26T12:00:01.000+03:00"
}
